{
  "name": "Discord Rich Presence",
  "description": "A Beat Saber Quest mod for displaying stats on Discord",
  "id": "discordrichpresence",
  "version": "0.3.4",
  "author": "Jess",
  "authorIcon": "https://avatars.githubusercontent.com/u/62964686?v=4",
  "modloader": "Scotland2",
  "download": "https://github.com/RainzDev/BSQ_DiscordRichPresence/releases/download/v0.3.4/DiscordRichPresence.qmod",
  "dependencies": [
    {
      "id": "beatsaber-hook",
      "version": "^6.4.2"
    },
    {
      "id": "beatsaverplusplus",
      "version": "^0.2.4"
    },
    {
      "id": "bsml",
      "version": "^0.4.9"
    },
    {
      "id": "custom-types",
      "version": "^0.18.4"
    },
    {
      "id": "metacore",
      "version": "^1.6.3"
    },
    {
      "id": "morebuttons",
      "version": "*"
    },
    {
      "id": "paper2_scotland2",
      "version": "^4.8.0"
    },
    {
      "id": "web-utils",
      "version": "^0.6.8"
    }
  ],
  "source": "https://github.com/RainzDev/BSQ_DiscordRichPresence/",
  "cover": "https://raw.githubusercontent.com/RainzDev/BSQ_DiscordRichPresence/main/cover.jpg",
  "funding": [],
  "website": "https://github.com/RainzDev/BSQ_DiscordRichPresence/"
}
