{
  "name": "SocketLib",
  "description": "socket_lib, version 0.11.1!",
  "id": "socket_lib",
  "version": "0.11.1",
  "author": "Fernthedev",
  "authorIcon": "https://avatars.githubusercontent.com/u/15272073?v=4",
  "modloader": "Scotland2",
  "download": "https://github.com/Fernthedev/SocketLibLinux/releases/download/v0.11.1/socket_lib.qmod",
  "dependencies": [
    {
      "id": "paper",
      "version": "^3.6.4"
    }
  ],
  "source": "https://github.com/Fernthedev/SocketLibLinux/",
  "cover": null,
  "funding": [],
  "website": "https://github.com/Fernthedev/SocketLibLinux/"
}
