{
  "name": "Qounters++",
  "description": "Add endlessly customizable counters to your ingame UI!",
  "id": "qounters++",
  "version": "1.1.3",
  "author": "Metalit",
  "authorIcon": "https://avatars.githubusercontent.com/u/48568911?v=4",
  "modloader": "Scotland2",
  "download": "https://github.com/Metalit/Qounters/releases/download/v1.1.3/Qounters%2B%2B.qmod",
  "dependencies": [
    {
      "id": "beatsaber-hook",
      "version": "^6.4.2"
    },
    {
      "id": "bsml",
      "version": "^0.4.55"
    },
    {
      "id": "custom-types",
      "version": "^0.18.3"
    },
    {
      "id": "metacore",
      "version": "^1.6.3"
    },
    {
      "id": "paper2_scotland2",
      "version": "^4.6.4"
    },
    {
      "id": "songcore",
      "version": "^1.1.24"
    }
  ],
  "source": "https://github.com/Metalit/Qounters/",
  "cover": "https://raw.githubusercontent.com/Metalit/Qounters/main/cover.png",
  "funding": [],
  "website": "https://github.com/Metalit/Qounters/"
}
