{
  "name": "CrashReporter",
  "description": "Automatically upload crashes.",
  "id": "crashreporter",
  "version": "0.1.12",
  "author": "darknight1050",
  "authorIcon": "https://avatars.githubusercontent.com/u/18632205?v=4",
  "modloader": "Scotland2",
  "download": "https://github.com/darknight1050/CrashReporter/releases/download/v0.1.12/CrashReporter.qmod",
  "dependencies": [
    {
      "id": "bsml",
      "version": "^0.4.43"
    },
    {
      "id": "custom-types",
      "version": "^0.17.10"
    },
    {
      "id": "paper",
      "version": "^3.6.3"
    }
  ],
  "source": "https://github.com/darknight1050/CrashReporter/",
  "cover": "https://raw.githubusercontent.com/darknight1050/CrashReporter/master/cover.png",
  "funding": [],
  "website": "https://github.com/darknight1050/CrashReporter/"
}
