{
  "name": "SongCore",
  "description": "Adds songloading, map requirement handling and related utilities to the game.",
  "id": "songcore",
  "version": "1.3.2",
  "author": "Raine & RedBrumbler",
  "authorIcon": "https://avatars.githubusercontent.com/u/64136899?v=4",
  "modloader": "Scotland2",
  "download": "https://github.com/raineaeternal/Quest-SongCore/releases/download/v1.3.2/SongCore.qmod",
  "dependencies": [
    {
      "id": "beatsaber-hook",
      "version": "^8.0.1"
    },
    {
      "id": "bsml",
      "version": "^0.5.5"
    },
    {
      "id": "custom-types",
      "version": "^0.20.0"
    },
    {
      "id": "flamingo",
      "version": "^1.1.2"
    },
    {
      "id": "lapiz",
      "version": "^0.3.5"
    },
    {
      "id": "metacore",
      "version": "^2.0.3"
    },
    {
      "id": "paper2_scotland2",
      "version": "^4.7.0"
    }
  ],
  "source": "https://github.com/raineaeternal/Quest-SongCore/",
  "cover": "https://raw.githubusercontent.com/raineaeternal/Quest-SongCore/main/cover.jpg",
  "funding": [],
  "website": "https://github.com/raineaeternal/Quest-SongCore/"
}
