{
  "name": "FingerSaber",
  "description": "Beat Saber At Your Finger Tips. @drumtool#4435",
  "id": "FingerSaber",
  "version": "0.1.1",
  "author": "Henri",
  "authorIcon": "https://avatars.githubusercontent.com/u/38835729?v=4",
  "modloader": "QuestLoader",
  "download": "https://github.com/im-henri/FingerSaber/releases/download/v0.1.1/FingerSaber_v0.1.1.qmod",
  "dependencies": [],
  "source": "https://github.com/im-henri/FingerSaber/",
  "cover": "https://raw.githubusercontent.com/im-henri/FingerSaber/main/cover.jpg",
  "funding": [],
  "website": null
}
