{
  "name": "ChatUI",
  "description": "Shows your Twitch Chat Ingame",
  "id": "chatui",
  "version": "0.2.8",
  "author": "darknight1050",
  "authorIcon": "https://avatars.githubusercontent.com/u/18632205?v=4",
  "modloader": "QuestLoader",
  "download": "https://github.com/darknight1050/ChatUI/releases/download/v0.2.8/ChatUI.qmod",
  "dependencies": [
    {
      "id": "codegen",
      "version": "^0.25.0"
    },
    {
      "id": "custom-types",
      "version": "^0.15.18"
    },
    {
      "id": "questui",
      "version": "^0.16.4"
    }
  ],
  "source": "https://github.com/darknight1050/ChatUI/",
  "cover": "https://raw.githubusercontent.com/darknight1050/ChatUI/master/cover.png",
  "funding": [],
  "website": null
}
