{
  "name": "SongLoader",
  "description": null,
  "id": "songloader",
  "version": "0.7.0",
  "author": "darknight1050",
  "authorIcon": "https://avatars.githubusercontent.com/u/18632205?v=4",
  "modloader": "QuestLoader",
  "download": "https://github.com/darknight1050/SongLoader/releases/download/v0.7.0/songloader.qmod",
  "dependencies": [],
  "source": "https://github.com/darknight1050/SongLoader/",
  "cover": "https://raw.githubusercontent.com/darknight1050/SongLoader/main/cover.png",
  "funding": [],
  "website": null
}
