{
  "name": "Fake ID",
  "description": "Sets the player age to an adult.",
  "id": "FakeId",
  "version": "0.1.9",
  "author": "DanTheMan827",
  "authorIcon": "https://avatars.githubusercontent.com/u/176073241?v=4",
  "modloader": "Scotland2",
  "download": "https://github.com/DanTheMan827-BeatSaber/Quest.FakeID/releases/download/v0.1.9%2B1.40.8_7379/Fake.ID.qmod",
  "dependencies": [
    {
      "id": "beatsaber-hook",
      "version": "^6.4.2"
    },
    {
      "id": "paper2_scotland2",
      "version": "^4.6.4"
    }
  ],
  "source": "https://github.com/DanTheMan827-BeatSaber/Quest.FakeID/",
  "cover": null,
  "funding": [],
  "website": "https://github.com/DanTheMan827-BeatSaber/Quest.FakeID/"
}
