{
  "name": "MyTemplateModName",
  "description": "MyTemplateModDescription",
  "id": "MyTemplateModId",
  "version": "0.1.3",
  "author": "MyTemplateModAuthor",
  "authorIcon": "https://avatars.githubusercontent.com/u/176073241?v=4",
  "modloader": "Scotland2",
  "download": "https://github.com/DanTheMan827-BeatSaber/mod-template/releases/download/v0.1.3/MyTemplateModName.qmod",
  "source": "https://github.com/DanTheMan827-BeatSaber/mod-template/",
  "cover": null,
  "dependencies": [
    {
      "id": "beatsaber-hook",
      "version": "^9.3.0"
    },
    {
      "id": "flamingo",
      "version": "^1.2.1"
    },
    {
      "id": "paper2_scotland2",
      "version": "^4.8.0"
    }
  ],
  "funding": [],
  "website": "https://github.com/DanTheMan827-BeatSaber/mod-template/"
}
