{
  "name": "Mapping Extensions",
  "description": "This adds a host of new things you can do with your maps as a mapper, and allows you to play said maps as a player. An update of the port of the PC original mod by Kyle 1413. Previously maintained by zoller27osu.",
  "id": "MappingExtensions",
  "version": "0.23.1",
  "author": "StackDoubleFlow, rxzz0, & rcelyte",
  "authorIcon": "https://avatars.githubusercontent.com/u/25163630?v=4",
  "modloader": "Scotland2",
  "download": "https://github.com/rcelyte/MappingExtensions/releases/download/0.23.1/MappingExtensions.qmod",
  "dependencies": [
    {
      "id": "paper",
      "version": "^3.6.1"
    },
    {
      "id": "songcore",
      "version": "^1.0.0"
    }
  ],
  "source": "https://github.com/rcelyte/MappingExtensions/",
  "cover": "https://raw.githubusercontent.com/rcelyte/MappingExtensions/master/cover.png",
  "funding": [],
  "website": null
}
