{
  "name": "PeripheralHUD",
  "description": "Move your in-game HUD into your peripheral vision, allowing for easy at-a-glance viewing of your combo, score, etc!",
  "id": "peripheralhud",
  "version": "1.0.0",
  "author": "Kaitlyn",
  "authorIcon": "https://avatars.githubusercontent.com/u/87990853?v=4",
  "modloader": "QuestLoader",
  "download": "https://github.com/whatdahopper-archive/PeripheralHUD/releases/download/v1.0.0/peripheralhud_v1.0.0.qmod",
  "dependencies": [
    {
      "id": "codegen",
      "version": "^0.25.0"
    },
    {
      "id": "custom-types",
      "version": "^0.15.18"
    },
    {
      "id": "questui",
      "version": "^0.16.4"
    }
  ],
  "source": "https://github.com/whatdahopper-archive/PeripheralHUD/",
  "cover": "https://raw.githubusercontent.com/whatdahopper-archive/PeripheralHUD/main/cover.png",
  "funding": [],
  "website": null
}
