{
  "name": "Better Song List",
  "description": "Improvement upon SongBrowser with similiar functionality",
  "id": "bsl",
  "version": "1.0.8",
  "author": "RedBrumbler, Pink, Kinsi55",
  "authorIcon": "https://avatars.githubusercontent.com/u/80212088?v=4",
  "modloader": "Scotland2",
  "download": "https://github.com/bsq-ports/BetterSongList/releases/download/v1.0.8-bs-1.40.8/BetterSongList.qmod",
  "dependencies": [
    {
      "id": "beatsaber-hook",
      "version": "^6.4.2"
    },
    {
      "id": "bsml",
      "version": "^0.4.55"
    },
    {
      "id": "custom-types",
      "version": "^0.18.3"
    },
    {
      "id": "paper2_scotland2",
      "version": "^4.8.0"
    },
    {
      "id": "playlistcore",
      "version": "^1.5.5"
    },
    {
      "id": "song-details",
      "version": "^1.0.5"
    },
    {
      "id": "songcore",
      "version": "^1.1.24"
    }
  ],
  "source": "https://github.com/bsq-ports/BetterSongList/",
  "cover": "https://raw.githubusercontent.com/bsq-ports/BetterSongList/main/cover.jpg",
  "funding": [],
  "website": "https://github.com/bsq-ports/BetterSongList/"
}
