{
  "name": "Smoothed Controller",
  "description": "Smoothes your Controller position while in menus to make it less shaky, making the UI easier to use, etc.",
  "id": "smoothedcontroller",
  "version": "1.5.1",
  "author": "Kinsi55, Kaitlyn",
  "authorIcon": "https://avatars.githubusercontent.com/u/87990853?v=4",
  "modloader": "QuestLoader",
  "download": "https://github.com/whatdahopper-archive/SmoothedController/releases/download/v1.5.1/smoothedcontroller_v1.5.1.qmod",
  "dependencies": [
    {
      "id": "codegen",
      "version": "=0.32.0"
    },
    {
      "id": "custom-types",
      "version": "=0.15.22"
    },
    {
      "id": "questui",
      "version": "=0.17.10"
    }
  ],
  "source": "https://github.com/whatdahopper-archive/SmoothedController/",
  "cover": null,
  "funding": [],
  "website": null
}
