{
  "name": "More By Core",
  "description": "More By Core, for 1.25.1! Lets you customize BeatSaber with added stuff!",
  "id": "morebycore",
  "version": "1.3.1",
  "author": "Core",
  "authorIcon": "https://avatars.githubusercontent.com/u/83958883?v=4",
  "modloader": "QuestLoader",
  "download": "https://github.com/Core-Quest/MoreByCore/releases/download/v1.3.1/MoreByCore.qmod",
  "dependencies": [
    {
      "id": "codegen",
      "version": "*"
    },
    {
      "id": "custom-types",
      "version": "*"
    },
    {
      "id": "questui",
      "version": "*"
    }
  ],
  "source": "https://github.com/Core-Quest/MoreByCore/",
  "cover": null,
  "funding": [],
  "website": null
}
