{
  "name": "Discord Rich Presence",
  "description": "A Beat Saber Quest mod for displaying stats on Discord",
  "id": "discordrichpresence",
  "version": "0.1.5",
  "author": "Jess",
  "authorIcon": "https://avatars.githubusercontent.com/u/62964686?v=4",
  "modloader": "Scotland2",
  "download": "https://github.com/RainzDev/BSQ_DiscordRichPresence/releases/download/v0.1.5/DiscordRichPresence.qmod",
  "dependencies": [],
  "source": "https://github.com/RainzDev/BSQ_DiscordRichPresence/",
  "cover": "https://raw.githubusercontent.com/RainzDev/BSQ_DiscordRichPresence/main/cover.jpg",
  "funding": [],
  "website": "https://github.com/RainzDev/BSQ_DiscordRichPresence/"
}
